<?xml version="1.0" encoding="UTF-8" ?>
<routes xmlns="http://symfony.com/schema/routing"
        xmlns:xsi="http://www.w3.org/2001/XMLSchema-instance"
        xsi:schemaLocation="https://symfony.com/schema/routing-1.0.xsd">

    <route id="route" path="/hello"/>
    <route id="overrided" path="/"/>
    <route id="alias" alias="route"/>
    <route id="deprecated" alias="route">
        <deprecated package="foo/bar" version="1.0.0"/>
    </route>
    <route id="deprecated-with-custom-message" alias="route">
        <deprecated package="foo/bar" version="1.0.0">
            foo %alias_id%.
        </deprecated>
    </route>
    <route id="deep" alias="alias"/>
    <route id="overrided" alias="route"/>
</routes>
