<?xml version="1.0" encoding="UTF-8" ?>

<routes xmlns="http://symfony.com/schema/routing"
    xmlns:xsi="http://www.w3.org/2001/XMLSchema-instance"
    xsi:schemaLocation="http://symfony.com/schema/routing https://symfony.com/schema/routing/routing-1.0.xsd">

    <route id="blog_show" path="/blog/{slug}" host="{locale}.example.com" methods="GET|POST  put,OpTiOnS" schemes="hTTps">
        <default key="_controller">MyBundle:Blog:show</default>
        <default key="_stateless">
            <bool>true</bool>
        </default>
        <default key="_static_generation">
            <bool>true</bool>
        </default>
        <requirement key="locale">\w+</requirement>
        <option key="compiler_class">RouteCompiler</option>
        <condition>context.getMethod() == "GET"</condition>
    </route>

    <route id="blog_show_inherited" path="/blog/{slug}" />
</routes>
